feasibility,description
1,Have a washing machine that can detect if clothes have stains and let users know which items have stains before you dry them.
1,Have a removable laundry basket that the clothes can be added/removed in.
1,Create program to help people understand how their washer works and how they can perform their own repairs.
1,Change the way that water is filtered out of the washing machine using bio-inspired design based on the way that camel nose's hold water.
0,"Create a new detergent that doesn't require the ""washing"" motion and instead just needs soaking in water."
1,The machine saves preferred load settings for a faster setup.
1,Use water spray jets instead of water pumps.
0,Repurposed the heat generated by washer to power dryer.
1,The machine is manufactured from parts that generate less electronic waste and is easy to take apart and recycle.
1,"For improving manufacturing operations, there can various ways to improve the assembly line, like the top panel is assembled automatically (through a robotic arm) right after the door in assembled to save time."
1,Have colorful and patterned exterior to increase appeal.
1,"Have extra long spin cycle. Although this would actually increase the energy used by the washer, it could decrease the energy used for drying the clothes, perhaps making it easier to line dry them."
1,Make parts non-manufacturer specific so parts can easily be replaced.
1,Have washing rubber balls that can be physically put into washing machine and increase the cleaning effects.
0,"Place a small water tank for the washer next to the house's heater or oven. When the washer is not being used, the water will just sit there. When one desires to do laundry the water will come from this tank and will not need to be heated."
0,Use light-weight plastic drum for efficiency.
1,Sense the load automatically and automatically determines the time to wash (This can avoid user choosing inappropriate washing cycle and wasting energy).
0,"Add sensors that detect how soapy the water is, so that the machine doesn't use more soap than required. Basically like titration -- make sure that you're adding just enough soap to fight the dirt in the load."
0,Develop materials that can clean the clothes with no water or minimal water.
0,Use mechanism that is similar to car washing tool that uses less water.
1,Have internal components that could absorb color dye to reduce number of loads due to separating clothes by color.
1,Use front-loading.
1,The machine has programmable wash settings.
0,Use better soap that don't require heat or rinse.
1,Have a quiet washing machine.
0,"Look at new high performance plastics instead of metal forming, which could increase durability and manufacturability."
1,Use simpler process with fewer options. Make the machine more autonomous.
1,Have the washer with cabinet made out of plastic that can be 3D printed or molded to eliminate parts of the manufacturing process. This also reduces the parts needed for the assembly.
1,Incorporate a generator that is run by the rotating motion to reduce the electricity usage of other appliance.
1,Use reclaimed water as the weight in the washer instead of concrete. Save on shipping costs.
1,Introduce washing machines of different sizes for different washing functions.
1,"From environmental perspective, instead of focusing on selling a machine to all users, create a hubs where users can drop off their clothes. Adding a functionality of controlling the machine at the hub using cellphones can be appealing to users."
1,Have a washing machine that automatically separates light clothes from dark clothes.
1,Power washing machines by wind and sun. Load washer early in the day and only start when conditions are optimal (lots of wind and/or sun).
1,"The machine definitely has to be smart, meaning it should learn from the user's habits and adjust. Also, it should be actively adjusting its washing cycle in order to attain maximum performance overall. For example, it could constantly monitor water content (being rougher or softer) and adjust it's washing cycle accordingly."
0,We can generate electricity from the refrigerator conceptually as a thermodynamically cycle. So we can use it as a power source in washing machine.
0,Wash the cloths somehow that they are not needed to be ironed.
1,Design for fully robotic manufacture and disassembly for improved lifecycle.
0,Use water pressure from the tap to assist tumbling motor.
1,Have a spot cleaning station so that you can use less water in the minimum load.
0,Use bio-materials with less weight to reduce the weight.
1,Limit the amount of different types of material used.
1,Have a washing machine with a sorting feature to recognize and separate clothing with different wash cycle settings.
1,Baked on paint sounds like it would take extra energy usage to do the baking. Replacing it with simply spray-on paint would save on manufacturing costs.
1,Have the machine run off of reusable energy.
1,"Provide a label indicating a full load, encouraging users to avoid washing small loads and wasting water."
1,Amount of required detergent is indicated by a line based on the load amount.
1,"Change classic ""spin cycle"" style to see if there is a better agitation method."
1,Have neighbors share washers and use internet alert system or schedule so people known when it is free to use.
1,Machine measures weight of clothes loaded and adjusts the amount of water and detergent use accordingly.
1,Have a ventilation system to prevent mold from forming inside washer when door is closed between loads.
1,Use smart temperature setting based on the level of dirt and loading.
1,Make parts easily replaceable so that repair is low-cost and only some parts need to be renewed every few years as opposed to the whole machine.
1,Use organic biodegradable paints could be used to reduce the environmental impact.
1,Use better wash preset for more efficient wash.
1,Make the washing machine smart.
1,Re-purpose old washers.
1,Sense water cleanliness to determine if it can be reused.
1,Make a mini washing machine that attaches to your bike with a cylindrical frame that rolls like a wheel as you ride and tumbles the clothing.
1,Have a shake phase to remove most dirt.
1,Have real time water consumption feedback to the user as a subjective norm in order to motivate them to conserve water.
1,Route water through filter and reuse it.
1,"The washing machine could be repackaged, optimized such that the center of mass is closer to the middle than on the side. Actually if the motor is placed horizontally below the drum with the force transmitted via gears, we wouldn't need a concrete block or maybe even the shock absorbers (friction with the floor wouldn't let the machine to rotate). Machine with fewer components is definitely more sustainable, especially without the concrete block."
1,"Incorporate remote functionality, i.e. from a phone."
1,A hybrid system which adopts water and bead technologies to clean clothing.
1,Design with the current manufacturing capabilities of the factory in mind.
1,Paint machines with different organic colors so the machines appeal to users.
0,"Improve the efficiency of washing by creating new washing methods, such as using dry cleaning or using steamed water instead of liquid water."
1,Do research to find a perfect ration to mix detergent and water in order to increase the efficiency of detergent.
1,"Shorten the wash time or provide more options for wash settings, so users can have a very short wash per se if they only have a few items compared with the traditional ""small load"" which often still uses a fair amount of water."
1,Use sensors to stop the wash when the clothes are clean so that they do not wear out.
1,"Have a washing machine that incorporates a new kind of motion to remove dirt from clothes, like impulse jets of water rather than large quantities of water being poured into the spinning drum."
1,Have cars that can use the mechanical movement to wash clothes
1,Use smart tap.
1,Have unique user interface to make interaction with the washing machine simpler. Perhaps incorporate a children's single button setting so parents could help children begin to do laundry as a chore at a young age.
1,"Systems that wash clothes in fundamentally new ways, such as using UV light to kill bacteria, or different additives that reduce the need for water use."
1,Remove physical buttons and replace them with a touchscreen that only powers on when needed.
1,Make the washing delicate so the clothes will last longer.
1,"Reduce number of required inputs for user, and remove options to use hot water."
1,"Run the machine based on two power sources, an AC household supply and a battery based supply that is connected to an existing home exercise machine."
0,Do experiments with other types of fluids for washing clothes. Perhaps there is a fluid out there that can be reused many times unlike water where we get rid of it afterwards.
1,Design a portable machine with modular components which can be assembled easily.
1,Have drum that can slide out with clothes as if it was the hamper and directly dump into dryer.
1,Provide readable statistics on how much water and energy is used vs others.
1,Manufacture washing machines with recycled parts.
1,"Use algorithm for calculating when is the best time to wash, how much load to put in, to maximize the usage of water and energy."
1,Pre-mix soap and water to ensure dry detergent is not left on clothes if using power detergent and concentrated detergent is not in contact with clothes if using liquid detergent.
1,Use better bearings.
1,"Attract users by increasing automation in the washing machines. For example, combining washer and dryer into a single machine."
1,Combine washer and dryer to save space.
1,Add attachments such as protein shaker that can make use of the movement of the machine.
1,Use some centrifuge to filter some of the dirty water and cycle that back into the wash to reduce water use.
1,"Utilize water from other home appliances, or use waste water from washing for other uses. This could include using water from the washer to then wash dishes, or implementing a greywater system to water the lawn (after removal of excess soap/detergent)."
1,When designing the polymer beads that may ultimately replace water within the washing machine it will be extremely important to insure that the lifecycle analysis of these beads does in fact result in a net reduction in water use If not then the current methods are still more desirable.
1,Have larger door for better access to clothing.
1,Give text alert for completion of laundry load.
1,More drying functions to reduce the damage of the clothes.
1,The machine is front loaded to save water and be better for clothes.
1,"Front load is more efficient but harder on back, so look at new loading techniques that are more ergonomic."
1,"Add upgrades to old machines to make them more energy/water efficient, rather than starting from scratch."
1,Have a sensor inside of the washing machine that adjusts the power needed to spin the drum be dependent on the weight of the clothes that have been loaded into the machine.
0,Try different designs and shapes for designing the washing tub such that it is more efficient and user friendly.
1,Reuse water for a few loads of laundry before sending it into the sewer.
1,Use polymer beads as an alternative of detergent.
1,Provide attachments for a hand wash mode when only a few items need to be washed.
1,"If a rotating drum is used, such that it can be powered by legs, then bicycle parts can be used. This makes manufacturing easier and as it provides some exercise, it can be appealing to the users."
0,"Have a machine that is powered by biofuels, such as garden trimmings and stuff that the user likely already has access to."
1,The machine recommends different setting for how to wash loads.
1,Have a spherical washing machine that can be used in outdoor activities
1,Design curvature and colors that produce happiness. Make the machine look sleek and modern.
1,Use squeeze mechanism for removing water.
1,Use sensor to keep track of water and power consumption.
1,"Add inserts into the washer to aid in passive agitation, as opposed to shaking the entire load like current front-loaders do. This would require fluid dynamic analysis."
1,See if there is a better method of driving the drum compared to the stator-rotor motor design.
1,Maintenance team that regularly checks on machine to make machines last longer.
1,"Waste water from the other resources can be entered into the machine, purified and reused."
1,Develop new materials used for washing clothes which are more environment friendly.
1,Use rubber gasket sealed inlet channel so that dirty laundry can travel straight from the laundry chute into the washing machine.
1,Like a sea anemone of squishy little arms sticking out from the walls to help clean the clothes.
1,Make washing machines out of recycled metal.
1,Use minimalist design.
1,Perform a study on optimal washing techniques to observe if the current model is the most efficient method. This provides the potential for a complete redesign of the washing cycle.
1,"Non-electric machine that uses hand crank to induce spin cycle. Water usage is restricted by size of machine. Maybe users can have two separate water tanks that stores soapy water, rinse water, and clean water. These water tanks can be used for up to three or four loads so that it reduces water usage."
1,Automatically load washing machine.
0,Add energy harvesting tech to regain lost energy in the washing machine.
1,Futuristic curb appeal can be easily created with LED lighting instead of painting materials - saves material and very low energy impact
1,Reduce water usage by using the waste water from washing machine for garden cleaning.
1,"Have internal lights that change color during the wash cycle, located inside drum (ideally for front loading washer) so that the light projects out."
1,Use better actuating mechanism.
1,Have an insert that shrinks the size of the effective drum for a small load.
1,Have an adaptor for solar panel that can be placed outside.
1,Have a washing machine that restricts water flow to be minimal (only what is necessary to complete wash cycle). Use less detergent so that fabrics require less water usage for rinsing.
1,Use cold and warm cycles only to reduce energy usage
1,Build non-load carrying parts from recycled materials to reduce cost of the machine for customers.
1,Additional hybrid modes between the ones they already have could be marketable to people who don't have the time to sort their laundry.
1,"In the age of autonomous vehicle, the car cabin has been shown to be used for other purposes. The washing machine could be connected to the autonomous vehicle by coupling the rotation to the vehicle motor and the dryer to air intake while the car is travelling. This way drying consumes far less power."
1,Design a resevouir that holds all of the detergent in a normal size jug so users don't have to store it.
1,Have variable sizes of washer for different loads of laundry.
0,Use the water from tap as a water jet to drive a turbine which drives the drum and spins it.
1,Treat the water with some chemicals before sending into the drum to improve the efficiency of washing process.
1,Change the angle of washing machine to let it use less water while washing.
1,Use alternative methods to heat the water.
1,Have a pretreat/soak option for tough stains and then automatically start the cycle once some time has elapsed.
1,Develop more specific washing method for washing different material and stain.
1,Machine that does not use liquid detergent. Instead it uses a cleaning process similar to dry cleaning. Water is not necessary and it keeps clothes fresh for up to two or three wears.
1,Increase motor speed to reduce water needed to clean clothes??
1,Have waterless washing machine that uses recoverable chemicals.
1,Different sizes of the machines to appeal to different users.
1,Make the machine have less vibration so it is quieter.
1,Remove the exterior paint.
1,The machine orders the detergent automatically once there is nothing in stock.
1,Use shock absorption technology for minimization of noise and vibration to allow faster spin cycles.
1,"Have smaller washing machine. This will reduce water requirements and energy consumption. It may also make users think about how much they are washing, because they have less space."
0,"Design a mechanism to suck out the dirt, similar to magnetic or hydrophobic separation."
1,Electricity can be generated when the cylinder is spinning.
1,Use the soap that doesn't make the water unusable.
1,Use the waste fibers from the clothes by filtering them from the water and utilizing it to make rugs and carpets .
1,Exercise machine can be integrated to help dry clothes.
1,Have a way of verifying that bleach is not going to stain the next load.
1,Determine the amount of water required based on the load weight and volume and save water.
1,Create chassis and weld together prior to painting to increase structural integrity.
1,Make drum size adjustable to accommodate the load size variability.
0,Forget about the washing machine. Have people reuse clothes until they fall off to conserve energy.
1,The washer connected to internet is able to provide live washing updates to smartphones. e.g.. notify users when the wash cycle ends.
1,Use natural based paint for body panels or use unpainted finish that uses less material and is cleaner.
0,"Utilize ""regenerative braking"" to capture energy lost when drum slows down between stages of wash."
1,"Give the user information about the characteristics of their load (mass, dirtiness, etc.) and then also tell them how much water/detergent/energy they will be using, and the eqCO2. This empowers the user to make lifestyle changes to decrease their total impact."
1,"Have side structural panels manufctured with recycled plastic, keepeing different colors and patterns which make the product attractive to young people."
1,Design motor to run off solar power.
1,A washing machine allowing to select dry-washing for not too much dirty clothes or wet-washing for heavily dirty clothes.
1,Have an outdoor washing machine that runs while it is raining and uses the rainwater to spin the clothes using the basic waterwheel concept.
1,Soak and press clothing to reduce the amount of mechanical motion.
1,Provide a digital read out of water used by machine per use/week/month/to make users more conscious of water consumption.
1,"Have cycles with optimal temperatures for mixed loads, to prevent washing many separate loads."
1,Have the hinge of the door be at the bottom of the door so the door opens to the top for easy loading.
1,The current counterweight used in the front end of the drum is steel. This material should be replaced with a heavy recycled material that can no longer be used as it intended to thus reducing the associated footprint of the washer.
1,Delay the start time for the wash.
1,The machine can rotate at where the door hinge is around where the drum opens to better fit the desired space.
1,Use a different floor/wall mounting technique so that the machine can be lighter without increasing operating noise.
1,"The shell is made out of glass so that users can look into the washer to see it operating from any direction, to improve aesthetics."
0,Produce with aluminum or other light and easy to recycle material.
1,Eliminate extra outer casing of machine.
1,Have a washing machine that is capable of washing smaller loads of laundry.
1,Further reduce the gap between inner diameter of plastic outer drum and outer diameter of stainless steel drum to reduce the amount of water use.
1,"develop more advanced washing mechanism, could be something like wash cloth one by one as we human do. This may be more efficient"
1,Have different designs to appeal different user groups. Do design research to determine the look of these and which possible designs these different user groups like.
0,Create fun advertisements so people are aware of the washing machines.
1,The washing machine with angled door (i.e.: 45 deg) with respect to the ground so that loading and unloading does not have to be done by squatting or leaning over.
1,Maybe find another common appliance in the house like dish washer to combine their actuation system to make the whole system more energy efficient.
1,Have some password or lock protection to omit kids using the machine.
1,Decrease the rotation speed of the machine so clothing will last longer and need to be replaced less often.
1,Shorten the time for washing and drying.
1,Add a device inside the washing machine that is moved around and helps know of dirt and debris on the clothes
1,Reuse materials from used machines to manufacture new ones.
1,Design drum that uses less soap.
1,"Determine optimal ""cleanness"" of clothes to maximize spinning power ratio."
1,Recognize when a hard object has been put in by accident.
1,Add bumps and ridges to inside of drum so clothes don't become a giant unbalanced wad.
1,"Make more options for the users so that they can fine-control the washing cycles. For example, the amount of water, more options for the temperature of water (not just hot,warm,cold). This will allow users to wash more delicate clothes and leave less damage."
1,The washing machine automatically turns off after 5 minutes of inactivity.
1,Collect water from rinsing at end and reuse it to soak clothes in the next load.
1,Make the washing machine quiet and emphasize how quiet it is in marketing.
1,Make the inner tub out of plastic or something more sustainable than a petroleum product.
1,The material used in the structure of the washing machine can be bio-compatible to have an optimized end-of life.
1,"Having a cool video, to market it, would help with user appeal. Like that Apple 'like video explaining all of the attention to detail that was put into the design, would make people like me want it. And probably a lot of the people that buy Apple stuff. The other videos about saving water in the news real style voice, could appeal more to a less-techy person. So you could have different marketing videos to market to different user groups increasing appeal and sales."
1,Use less overall material in the machine.
1,Make the washing machine a shape that allows the water to flow better.
1,Have a washing machine that automatically applies stain remover to clothes with stains.
1,Separate chamber to deal with different clothes type and different color of clothes because some white clothes would get colored with washed with colored clothing and some needs delicate care whereas some needs strong cleaning.
1,Use minimum material so that washing machine is sleek and doesn't take too much space.
1,"The main structure of a washing machine is made out of metal: keep the main structure of a sturdy material, but for all of the outer non-structural materials, construct them out of recycled plastics."
1,"Design a washing machine that has filters that could sanitize and reuse water in the wash cycle all over again, reducing water usage."
1,Use solar energy to power washing machines.
1,Use a drive train with different gear ratios to allow for smallest motor.
1,Combine washer with other similar appliances at home to optimize the energy efficiency of both.
1,Have a new washer mechanism.
1,Use raw material that could be locally sourced to reduce production cost.
1,A web enabled washer which can learn washing patterns and preferences of the user to better customization.
1,Minimize the weight of machine.
1,Use machine learning to learn user preferences in washing process.
1,Have a washing machine powered by battery and charged by a treadmill.
1,Make the washing machine silent with internal noise damping and cancellation features.
1,"Have different washing modes based on different clothing types (shirt, pants, jeans etc.)."
1,Use a hybrid motor to use water flow as well as electric power.
1,The machine keeps statistics about how much water is used each year.
0,"Attach an efficient water heater (with high heat transfer metal coils in a water tank) to the machine, so that if the user has an old water heater at their place, it doesn't use as much energy to run the washing machine."
1,Use a different mechanism for drying clothes.
1,"The machine is able to have lots of settings without using touch screens, since touch screen takes up more electricity and battery power."
1,Use the same drum for washing and drying adapted with sensors to identify the dirt level.
1,Using larger machines may be more efficient if user puts more clothes into it.
1,A washing machine that includes a small battery that can be charged eventually from human activity. This could help reduce electrical consumption.
1,Replace the hinged front door with a telescopic sliding door. This will allow the machine to be installed in even smaller space and be more user friendly.
1,Incorporate touch screen interface that sends a reminder when the cycle is complete.
1,"Remove superfluous packaging, which only adds aesthetic value."
1,Use geothermal energy to directly preheat water going into the washing machine.
1,Using a high pressure jet of steam and soap particles to clean clothes to Eliminate the need for a motor.
1,Have an option to pair washer to phone location so that washer runs when you leave home to be less noisy or annoying.
1,Provide a demand response feature for the power grid. Demand response corresponds to drawing power from the power grid at specific time of the day to maintain a balance between supply and demand. Utilities compensate the appliances participating in the demand response program.
1,Have the washing machine ads educate the population on more efficient use of the machine. Maybe washing certain types of clothes or ones having certain stains makes for a more efficient use of the machine. Saved time could appeal to the customers
