feasibility,description
1,Allow a timer on washer to run at night when electricity demands are low.
1,Design dual function drying rack holding rack.
1,Provide more direct information about energy use and water use and cost when selecting washing modes.
1,Have multiple mini drums in one machine to speed up time required for a small household with small load levels.
1,"Machine measures detergent and provides a warning when overused, preventing soap from spilling out and clothes needing to be washed a second time"
1,"Design a human powered washing machine. It could be powered by a treadmill or some sort of exercise equipment, such as stationary bike."
1,Find more efficient spinning speed to decrease the water use and energy use.
1,"Use water from showers and baths for washing clothes, and then pass on water to water plants."
0,Steam from kitchen can be used for driving the machine if possible.
1,Automatically dispense soap for efficient displacement of soap.
1,Have users load from the top and then it transfers it to a sideways drum either through a pathway or just rotates the whole drum before starting.
1,Put two chambers in washing machine for white and colored clothes. Filter water and reuse for both chambers instead of running the machine twice.
0,Washing machine detects dirt and automatically stops or continues cycle depending on how much dirt is detected.
0,Use coupled systems to reduce waste energy between modules.
0,Use computer vision to focus more on the dirty spots could reduce the work needed.
1,Make the production wise and efficient (i.e.. low carbon footprint to build).
1,Create a new type of detergent that requires less water and is more efficient in cleaning.
1,Two door systems. The clothes are put in through the top of machine and rotates to the side when the washing is done. Easier to load the machine and eliminates the danger of kids getting into the machine.
1,incentivize trade-ins of old washers for newer ones
1,"3D print some parts. It might reduce the original cost, but increase the maintenance cost."
1,Use cold water only for the washing machine.
1,Use local parts suppliers to reduce the emissions in parts transportation
1,Move manufacturing to a more sustainable facility.
1,Use automatically attachable or detachable flywheel for spin stage.
1,Using optimal control methods to identify new strategies for the washing cycle.
1,Have a rewards program for users so that they really feel great about being more sustainable.
1,Reuse washer water for watering plants.
1,Use non-toxic and biodegradable material to remove stains.
1,Water consumption can be reduced by finding a way to clean the soapy water and reuse it.
1,Save rinse from previous load to wash next load in.
0,"Use live organisms to clean clothes, like cleaning dirty water."
1,Have very good gaskets so that there are no leaks anywhere.
0,Biological enzymes automatically clean clothes and reduce overall energy consumption. Because of the enzymes the washer doesn't need to rotate reducing manufacturing cost.
1,"Snap on fasteners instead of screws for outer panel where leaking is not an issue will reduce the assembly costs, but may increase manufacturing costs."
1,Design the machine as a multipart system to dismantle and assemble again for the purpose of efficient distribution.
1,Implement a folding manufacturing process to reduce panel assembly time.
1,"Have agitators that can be present during ""washing"" phase at a lower spin-speed, but. can be absent during rinsing."
1,Use a detergent ball that contains detergent and outputs the detergent amount accordingly to the soil level or amount of cloths. Detergent ball will constantly hit cloths while washing so that it will reduce time and energy to wash clothes.
1,Use the rotation of the washing machine for energy harvesting (small scale) to generate power to power up small electronics like cell phones.
1,"For more efficient assembly, a self-assembling origami structure could be used as the outer section and inner retaining brackets. This structure could be stamped out of a single piece of metal, with compliant joints at the hinges/edges of the box."
0,"The data gathered by the washing machine can be gathered and analyzed across neighborhoods and cities to analyze the water usage in the washing machine as a function of the region, time and water availability."
0,Only allows washing of matched socks.
1,Harvest energy and reuse machine on vehicle wheels.
1,"Translate energy lost to pistons to generator power source (lights in the house, etc.)."
1,Minimize the number of components on the surface of the machine.
1,Design a washing machine where you could put a basket of different items to be washed and the machine will separates them into different loads that maximize power consumption and usage.
1,"Top-loading dryers are more convenient but front-load are more efficient. Have a washer that can be loaded from the top, drum ""rotates along major axis 90deg, and then begins wash cycle."
1,"As opposed to dedicated shock absorbers inside the washing machine, the structure itself could be designed to absorb the vibrational load and provide damping. This could involve, for example, compliant mechanisms on certain parts of the structure whose natural frequency was tuned to match the drum vibrational frequency at different drum speeds, and which would then dampen the vibrations. Multiple different sets of mechanisms could be used to dampen different frequencies."
1,Use gray water washing machine that only allows certain types of environmentally friendly detergents.
0,"It could use your home's Wi-Fi instead of it's own cellular connection, so that it saves user money and energy."
1,Thermal energy will be dissipated by spinning the stator motors. That energy can be stored and reused.
1,"Have a cool interactive outside to appeal to kids, so that they can lobby their parents to buy one. Could use some cool mechatronics, interactive artwork on the exterior to make it a piece of art that can appeal to kids."
1,Design energy recover systems at the vibration dampers for alternative use.
1,"Let the washer fill part way with water and mix with the soap before users put clothes in. It might appeal to customers to have the detergent pre-mixed with the water, or to spray in from multiple locations at once instead of all getting sprayed on just one clothing item."
1,"Use Siri like features to be able to talk to the machine and let it ""know"" the kind of clothes its dealing with."
1,Separate the drum into compartments such that the loads can be more evenly distributed along the perimeter. This could help reduce vibration which makes it more appealing to the customers. Reduced vibration can also improve energy efficiency of the motor.
1,Make the exterior of the washing machine more stylized in the form of environmental qualities to make the user more aware (even subconsciously) of the environment during use.
1,Locate manufacturing facilities in various locations to reduce transportation cost.
1,A human powered washing machine may be useful. Leg powered using a bicycle kind of pedaling mechanism can be used to rotate the drum inside which the clothes are washed. This reduces energy consumption in the form of electricity.
1,"Compute a ""green score"" for each wash cycle based on water, energy and detergent used and give users a green score target. Maybe give some incentive if a particular target is hit."
1,Phone charger built into machine for community use
1,Add a module that keeps the detergent for a longer time and sends an alarm when there is no more stocked.
1,Find a better water and detergent distribution in the machine to help with washing efficiency.
1,"Have one item wash mode for very fast, and low energy washing."
1,Have a speed mode: mode that washes your clothes extra fast when you are in a hurry.
1,A machine which can fold the clothes after drying and ensures clothes do not need to be pressed again.
1,Use material recycled from used product to decrease cost of raw material.
1,Make the machine out of strong injection molded plastic to reduce the cost of making them in high volume.
1,Have workers assembled all parts instead of robots and workers.
1,"Market products on water saving feature, appealing to consumers who have knowledge of the need for water conservation. Target locations such as California which are undergoing droughts."
0,The machine uses heat from HVAC systems to heat water/air for washing and drying.
1,Use 3d printers to manufacture washing machine parts.
1,Change design of the spinner so that it spins and dries clothes faster.
1,Connect washing machine to provides information on sustainable practices and what resources to use.
1,Have a talking washing machine.
1,Water is heated by gas vs. electricity (gas is cheaper in some states) so it appeals to customers who live there.
1,Combine spin drying and hot drying.
1,Use vacuum to kill the bacteria.
1,During the rinse cycles recirculate the water from the bottom of the drum to the top and spray it into the drum. This will help rinse out the clothes while reusing water and decreasing the spin cycle time.
1,The laundry basket senses how dirty clothes are and separates them so that some loads only wash relatively clean clothes and don't have to use as much detergent.
1,Incorporate a drying aspect to the machine to hybridize its function.
1,"Couple the washing machine directly to renewable energy sources, and sell the two together as a package. This could include wind, solar, or geothermal."
1,"The machine would be a front loading machine capable of spinning at higher speeds than conventional machines, thereby producing less water content in the fabrics after the wash cycle. Due to low water content in the clothes, the dryer function in the machine would not have to be as powerful or use as much energy as conventional dryers."
1,Definitely make the washing machine a front loading device with a wide door that has a large range of opening.
1,The washing machine's rotational movement could be used to charge a battery and save energy.
1,Use a complete automatic system with no human intervention to save time during manufacturing.
1,Have a washing machine with integrated counter top so it can be used for other things.
1,"Have an intuitive user interface, like simple control panels that could make the product more sustainable."
1,Install a scale and camera on the inside of the washer. The scale will be used to measure the weight of the items inside the washer and will determine the amount of water needed to clean the load. The camera will use image analysis techniques to determine the types of items in the load and automatically set the best water temperature and spin speed.
1,"Before adding water, a shake out mode is use to shake out most dirt."
1,Remove paint from external parts to reduce amount of material cost.
1,Design a light and portable washer that can be taken on the go to wash clothes whenever needed.
1,"Even though the drum may look rustic, its appeal can be improved by using different colors and materials, especially easy weight."
1,Use fewer fasteners to speed up manufacturing time and reduce weight.
0,Create a mix of detergent with the some kind of pellet particle to provide a deep clean with less amount of detergent.
1,Manufacture machines differently to make it last longer.
1,Use easily manufactured body with sophisticated outer shell to give appearance of very high quality.
1,"Machine stores soap water from a wash and reuses it for the next wash, which will reduce water and soap usage."
1,Provide visual feedback to the user regarding the overall energy consumption from the washing machine.
1,Harvest thermal energy in the washer to save energy and use it to heat water for other household appliances.
1,Design a machine that requires less water.
1,Allow people to customize the water level in the washing machine during wash cycles.
1,The machine will automatically determine the cycle time to save energy.
1,Use some decomposable absorbent that can be thrown into laundry load to help absorb dirt and oils but does not consume that much water.
1,Have a laundry basket attached to washer that automatically loads and starts washer when it gets full.
1,Build in sensors to enable washer running when electricity is at its cheapest price to reduce cost.
1,The pistons below the drum are designed to dissipate vibrations that occur due to unevenly distributed weights. These should be replaced by springs which are connected to some type of generator so that some of the dissipated energy is then recaptured.
1,"Use some fuzzy logic controller that adjusts the water temperature, water volume, and detergent volume to get the best wash cycle to save on water and detergent."
1,Have a washing machine that does not need to be connected to the main water line in the house so it can be used at home without a hookup.
1,Use wasted water to cool motor to increase efficiency.
1,"Looking at the washing process and optimizing it to potentially reduce the time spent doing the job, which would reduce energy and water consumption."
1,Route used water to your sprinkler system so it waters your yard.
0,Use chemical based washing instead of water based washing.
1,"Have a way to collect the steam and condense it, filter it for later use. Save on water."
1,"Use two wash drum, concentric from each other, with smaller drum at the center and bigger one on the outside."
0,Have washing machines that can use shower water and human soaps to wash clothes.
1,Make the amount of water that is used by each setting visible.
0,Reduce vibration of the machine and if not possible then use pressure sensitive (piezoelectric) materials to convert the vibration into energy.
1,Use steam for cleaning when clothes are not super dirty. This can reduce water use and decrease use of chemicals.
1,Movies or other media can be projected on to the door so that kids can be entertained when parents are doing laundry.
1,Design a smart washer that knows the type of material and optimizes the washing cycle accordingly to conserve resource.
1,Machine with a chute or feeding tray for loading and a basket for unloading. Drop the clothes in the chute and the clean clothes are put in a basket.
1,Make the washing faster so that users save time and energy by not having it run as long.
1,"Have a hybrid washing machine. Part electricity part solar, or wind or human powered etc."
1,"Can detect a solid mass tumbling around throwing off the stabilizers, such as a phone, and set off a warning or stop the washing process."
1,Spray water equally in mist phase for soaking laundry faster and using less water.
1,"The machine is resistant to different types of detergent, especially those more corrosive."
0,Automatically detect when clothes are clean enough and stop cycle.
1,Introduce environmentally friendly detergent so that the waste water can be further recycled.
1,Use easily manufactured parts and pieces that are easy to put together on the assembly line.
1,"Use additive manufacturing to make more parts at once using robots, and require less labor from human factory workers."
1,Have fabric cover instead of painted and stamped steel cover for washing machine side panels.
1,Use new material to make products that generate less force or are less energy-consuming.
1,Machine has a voice interaction system and can be controlled by users' voice commands.
1,"Instead of using polymer beads or a cleanser similar to dry shampoo, the washer could require an advanced detergent that latches onto the dirt and stains and removes itself from the clothing. This detergent would not need to be rinsed out because the dirt is in the water and not on the clothes. This method would eliminate the need for a rinse cycle and reduce water usage."
1,"Having different parts of the washing machine structure vibrate when the drum is running at different speeds could be an aesthetically appealing function. for example, if the top right of the washing machine vibrated during permanent press spin cycles (slower) but the top left of the machine vibrated during cottons spin cycles (faster), then a user could visually determine what settings the machine is using. This functionality would be a fun visual way to tell from a distance what was selected."
1,Each leg has a hydraulic or some type of shock absorber that drastically lessens the noise and shaking.
1,LEDs that consume less power could be used to make the washing machine aesthetically pleasing.
1,Automatically loads clothes into the dryer after wash.
1,"Design the machine to have fewer parts, which means easier assembly line and lower manufacturing cost."
1,Change the construction materials and 3D print it.
1,Have an app that shows exactly how much water is being used. Plays customized alarm when done
1,Funnel that automatically sorts clothes and clothes types and sets the appropriate setting.
1,"For communities near salt water sources, wash water using salt water. decreases environmental impact and costs less for consumers. Salt may also have additional cleaning benefit"
1,"Portable electric washing machine that is made of lightweight materials, and smaller than conventional machines and requires smaller loads."
0,"Create an eco friendly spray that could be sprayed on clothes to cleanse them of any bacteria or smell. While this is not a washing machine, it will increase the number of times a user can wear a garment in between washes, thus saving on water and electricity."
1,Have color safe panels built into the machine to catch potential color bleeding.
1,Use more sensors.
1,Use alternative affordable materials (such as aluminum) instead of steel if the loading permits such use.
1,"Introduce a soak cycle, which allows clothes to soak in detergent for ~10 min before wash cycle begins, thereby reducing electricity consumption associated with actively ""tossing"" clothes."
1,"The machine learns your habits, and cycles. It can use the most economic cycle depending on load size."
1,Paint the machine fun colors.
1,Test out different methods of actuation for the washing machine. Perhaps linear motion or some other combination of motions.
1,"The interactive UI can be used to provide advices to the user on how to treat and wash different clothes, e.g. what kind of detergents to use, and whether they can iron them or not."
1,Go from traditional washing machine designs (spinning tumbler) to maybe a different shape such as a rotating sphere where clothes would be placed inside.
1,Have larger load capacity so people can wash more at once.
1,Have a smart washer/dryer combo that users can control with an app so that all settings can be done remotely.
1,Design a power machine with artificial intelligence that will wash clothes linens at times when power consumption is cheaper.
1,Reduce amount of material used to lower cost and reduce energy needed to run.
1,A washer is capable of harvesting and converting some of the rotational energy from the drum into pneumatic energy for pressurized rinse cycles.
1,Harvest vibrations from washing machine somehow to generate electricity.
1,"If the motor mounting point was moved from one extreme end of the washing barrel towards a more central location, then fewer counterweights would be needed at the opposite end. The added weights make spinning more difficult and therefore reduce the efficiency."
1,Simplify construction so that machines can be assembled by users and reduce cost to consumer.
1,Use closed loop water recycling system.
1,Coat the inside of the laundry machine with the dirt absorbent beads; have a marker that changes color like toothbrush bristles when they have been overused and the sheet of them needs to be replaced
1,"Use less water and detergent by customizing the amount based on a combination of factors such as clothes type, environment temperature (for drying) etc."
1,"Educate users to have more efficient wash, for example wash less dirty clothe first."
1,"You could have the washer and drier in the same box, so that it could intelligently turn off, and start the drier when it saves the most electricity, or when you aren't sleeping, or just right after if you want it done immediately"
1,"Make the washing machine smaller, thus encouraging users to do smaller loads of laundry."
1,During the final assembly stages of the washer many of the parts are screwed and bolted together by hand. This process should be done by a fast and efficient robot instead.
1,Use the water from the washing machine to fill and flush toilets.
1,Incorporate water filter for water re-use in subsequent wash cycles. There could be a (hand-washable) filter and a storage tank in the washing machine that collects filtered water from prior wash cycles.
0,Accomplish washing and drying simultaneously.
1,The machine has ability to save settings from wash to wash.
1,"The washer motor can also be made to drive a companion dryer through some sort of transmission system so that one motor can spin either one or both of the units, thus eliminating the need for a motor in each unit."
1,The control panel can be powered by batteries charged by solar panel or by a dynamo connected to the machine rotor.
0,Have a super fast washing machine.
0,Look into reducing the cost of the machine by getting them manufactured in a more efficient way.
1,Use low temperature washes or strategically heated water.
1,Reduce the friction present from spinning the drum so that power consumed by the washer is reduced.
1,Have a washing machine that corrects you when being inefficiently used.
1,Customize cycles for certain types of washes.
1,Have the machine run for less time.
1,Develop a combo of washer and dryer system where shaft motion of dryer is used to charge a battery or power dryer cycle.
1,Make machine smaller to prevent wasteful small loads in larger machines.
1,Make the height adjustable for ease of access.
1,Use alternative of water like absorbable beads.
1,Examine steps in the manufacturing process that can be eliminated or combined to reduce production footprint.
1,Install LEDs for the machine to look cool.
1,"Have the washing machine weigh how much clothing it is given, and allocate water appropriately. This will also increase product's appeal because it is techy, and people like that. It will save them money when they have small wash loads."
1,Use a new motor design.
1,Improve the functional attributes of the washing machine and make those more apparent to the users when purchasing the product.
1,Use the cleaned water from dishwasher for the washing machine.
1,"For a washer/dryer unit, if the dryer is running simultaneously, use waste heat from the dryer to warm up water for the washer."
1,The washer is able to send notifications to phone when it is done to reduce chance of mildewy clothes.
1,"If the machine has a drying cycle, the last washing cycle could be just long enough to allow proper drying."
1,Make an interactive app that sends users information about water and energy consumption and that also suggests how much money has been saved and how much still can be saved if the machine is used differently. Actually numbers could stimulate people to use the machine more efficiently.
1,Have the remote control system instead of touch panel as an app on smart phone to specify the cloth and color and by having the weight measuring system. The machine can automatically decide the amount of detergent and water amount and temperature.
0,Design a motor that uses gravity to power the drum instead of electricity.
1,Have a monthly maximum power/water output from the washing machine that users cannot exceed.
1,Borrow concepts from dry cleaning to design a cycle option that reduces water usage through the addition of specific chemicals.
1,Provide manual operation as an option to save electricity and give some incentive.
0,Have ultrasonic washing machine to reduce the need for water and to decrease washing time.
1,Control the heat for water.
1,Use nano-material in door seals to have a perfectly water-proof machine.
0,"Design disposable or decomposable clothing, which would eliminate the need for a washer."
1,load sensing strain gauges could be used to use minimum water in combination with the polymer beads.
1,"The machine can store the entire detergent container and it will use the required quantity of it according to the mode of use. This will reduce the effort needed on the customers' part. Multiple detergents can be loaded, mixed and used."
1,A washer which automatically senses the colors of clothing put into it enables it to pick the most appropriate wash cycle.
1,Combine washing and drying machines to reduce machined parts.
1,"Use rust-resistance materials for the front door of washer. Use some kind of material which use less water to clean cloths, and use higher speeds for washer."
1,"Have a washer that is capable of recycling water to be used during multiple washing cycles, or that is connected to other devices in the house that also use water."
1,"Eliminate conveyor belts from manufacturing process, have employees do more of the movement themselves (less time efficient, but more energy efficient and probably more engaging for employees)."
1,Design inside tube of washing machine so that it can create a more efficient washing cycle without having to use much force (energy) or water.
0,Use synthetic material to agitate clothes and minimize the water required.
1,"Use a combination of multiple dampers to reduce vibration from multiple stage, i.e., frequency of tumble stage, spin stage, etc."
1,Use wind turbine to power up washing machine.
1,"Use mist or steam (like some new shower heads that use 20% as much water, but still feel like a regular shower) to reduce the amount of water needed to clean the wash load."
1,"Have the washing machine make recommendations to users on how they can reduce the energy or water they use, for example, which types of clothes they can combine in a load."
