novelty,description
1,"develop a voice-activated, ai-powered washing machine for hands-free operation."
0,add a bleach dispenser for easy addition of bleach during the wash cycle.
1,develop a washing machine that uses negative ions to remove dirt and stains.
1,"create a transparent, interactive display screen for users to monitor the washing process."
0,have an additional rinse option for clothes with stubborn dirt.
1,integrate an ai system that learns the washing habits of the users and suggests the most optimal wash cycle.
0,use led lighting inside the drum for better visibility.
1,develop a washing machine that uses co2 cleaning technology.
0,have a washing machine with a child lock for safety.
1,incorporate ai that can detect different types of fabrics and adjust the washing method accordingly.
1,incorporate a built-in dehumidifier that absorbs the moisture from the air and uses it to wash the clothes.
0,have a built-in softener dispenser for fabric care.
1,"use smart technology to monitor wear and tear of the machine, and alert the user for preventive maintenance."
0,offer a machine with a self-cleaning cycle to keep the drum fresh and odor-free.
1,"incorporate iot technology, allowing users to control the washing machine remotely using a smartphone."
1,develop a washing machine with a built-in wardrobe where the machine directly hangs the clothes after drying.
0,have a washing machine with multiple spin speed options.
0,include a separate drawer for washing delicates and small items.
1,develop a washing machine with a robotic arm for loading and unloading clothes.
1,add an ozone disinfection system for a deep and thorough clean.
0,offer a high spin speed option for a more efficient drying process.
0,include a detergent residue detection feature to ensure thorough rinsing.
1,design a washing machine that uses vibration and heat to remove stains without the need for harsh chemicals.
0,use an automatic door lock during wash cycle for safety.
1,"design a machine that can wash, dry, and iron clothes automatically."
1,incorporate a uv light for disinfecting clothes during the washing process.
0,make a washing machine with energy-saving modes.
1,develop a compact
1,"incorporate a sensor that detects the optimal amount of detergent, water, and energy to use based on the load weight and type of fabric.  travel-friendly washing machine that can be operated using a car's power outlet."
0,have a washing machine with a digital timer display.
1,add a smart diagnostic system that identifies problems and suggests solutions.
0,add a gentle steam option for refreshing lightly soiled clothes without washing.
0,provide an energy rating to inform consumers of the machine's energy efficiency.
1,create a washing machine that can be powered by solar or wind energy.
1,"design a washing machine with a detachable, portable section for camping or travel."
1,incorporate a system to soften hard water for better washing results.
1,develop a washing machine that uses a waterless cleaning technology.
0,offer a prewash option for heavily soiled clothes.
1,"incorporate a feature that enables washing, drying, and folding clothes into a single, automatic process."
0,use larger door openings for easy loading and unloading.
1,create a washing machine that uses water from the air by absorbing and condensing humidity.
0,add a buzzer or alert when the wash cycle is complete.
1,integrate a built-in ironing system that irons clothes during the final stage of the wash cycle.
1,design a washing machine that uses a natural enzyme solution as an alternative to conventional detergent.
0,use rust-resistant materials for increased durability.
1,create a machine that uses ultrasonic waves to remove dirt and stains.
0,design a washing machine with an automatic lint removal system.
1,develop a washing machine that recycles waste water for future wash cycles.
1,create a washing machine that uses air pressure and vacuum to wash clothes.
0,offer a machine with an option for extra rinse cycles.
1,integrate a smart power management system to reduce energy consumption during peak hours.
0,have a machine with a transparent lid or door for easy monitoring of the wash cycle.
0,offer a machine with a delay start function for scheduling wash cycles.
1,develop a washing machine with a self-cleaning detergent dispenser.
0,offer a washing machine with adjustable leg heights for stability on uneven floors.
1,design a washing machine that uses cold plasma technology for effective stain removal.
1,integrate smart grids to optimize energy use based on real-time energy prices.
0,use energy-efficient motors for better performance and lower energy consumption.
1,"develop a washing machine with an integrated laundry basket, the machine automatically empties and starts washing when the basket is full."
0,offer machines with a range of color options to suit different home decors.
1,design a washing machine that uses eco-friendly bacteria to remove dirt and stains.
1,create a washing machine with an integrated drying rack for air-drying delicate items.
1,develop a washing machine that uses radio frequency identification (rfid) technology to determine the fabric type and adjust the wash cycle accordingly.
1,incorporate a sensor system that adjusts the water level according to the load size for optimal water usage.
1,design a washing machine that uses natural cleaning agents like activated charcoal instead of detergents.
0,add a fabric softener dispenser for enhanced fabric care.
1,incorporate a reverse osmosis system for efficient use of water.
0,use a more ergonomic design for easier loading and unloading.
1,develop a washing machine with a folding feature that automatically folds clothes after drying.
1,add a feature that alerts users when maintenance or cleaning of the washing machine is required.
0,add an easy-to-clean lint filter.
1,incorporate a heat pump for energy-efficient drying.
1,"design a washing machine that uses sonic technology, creating high frequency sound waves to remove dirt and stains."
0,add a child safety lock feature.
0,offer a 'quick wash' feature for lightly soiled items.
1,create a washing machine with an automatic load balancing system that adjusts the load during the spin cycle.
1,incorporate a noise reduction system for a quieter wash cycle.
1,create a washing machine with an integrated clothes steamer for wrinkle removal.
0,add a display that shows the status of the wash cycle.
1,develop a washing machine with built-in sensors that detect and remove pet hair.
0,design a washing machine with a top-loading feature for easier loading.
1,incorporate a built-in laundry folding system.
1,incorporate a smart system that adjusts the wash cycle based on the weather forecast.
0,include a washing machine with a built-in crease guard to reduce wrinkles in clothes.
1,incorporate ai that learns the optimal wash cycle based on weather conditions and type of clothes.
0,provide an option to select the preferred water temperature for washing.
1,develop a washing machine that uses uv-c light to sanitize clothes without using any chemicals.
0,add a countdown timer to display the remaining time for the wash cycle.
1,create a machine that generates its own detergent using a combination of water and salt.
0,design a washing machine with an easy to clean filter system.
1,design a washing machine that uses sound waves to loosen dirt and stains.
0,offer a washing machine with an end-of-cycle signal to alert the user when the wash cycle is complete.
1,develop a washing machine that uses biodegradable cleaning beads instead of traditional detergent.
1,incorporate a sensor system that recognizes and remembers the user's favorite wash cycles.
0,offer a washing machine with a built-in fabric conditioner dispenser.
1,develop a washing machine that uses an ai-driven system to match the type of detergent with the clothes' fabric and color.
0,offer a washing machine with a pause function to add or remove clothes during the wash cycle.
1,create a washing machine that uses a water mist and heat to clean clothes without using any water.
1,incorporate ai to monitor and learn from different wash cycles and suggest more efficient washing programs.
0,provide a machine with an antibacterial drum to prevent bacterial growth.
1,create a washing machine that uses electrolyzed water as a safe and powerful disinfectant.
1,design a washing machine that connects to a home's smart grid to optimize power usage.
0,include a 'reduce creases' function that minimizes wrinkles in clothes.
1,develop a washing machine that uses ionic technology to clean clothes without detergent.
0,offer a washing machine with adjustable spin speeds to suit different types of clothes.
1,create a washing machine with a built-in clothes sorter that separates clothes based on color and fabric.
0,use vibration reduction technology for a quieter operation.
1,develop a washing machine that uses microwave technology to dry clothes quickly.
0,provide a machine with an eco mode for energy-efficient washing.
1,create a washing machine with a feature that automatically determines the optimal wash cycle based on the clothes' dirt level.
1,develop a washing machine that uses infrared light to kill bacteria and viruses.
0,include a washing machine with a built-in bleach dispenser for convenient addition of bleach.
1,incorporate a smart filter that alerts users when it's time for cleaning or replacement.
0,offer a machine with a drum cleaning function to keep the drum fresh and free from bacteria.
1,design a washing machine that uses lasers to break down dirt and stains.
1,create a washing machine with a smart energy management system that optimizes energy usage based on real-time energy prices.
0,include a washing machine with a variety of wash programs for different types of clothes.
1,develop a washing machine that uses graphene technology for efficient energy usage and high-performance cleaning.
0,add a wool program for gentle washing of woolen clothes.
1,create a washing machine that uses biometric authentication for enhanced safety and personalized settings.
1,incorporate iot technology to receive updates and notifications about the washing cycle on your smartphone.
0,provide a washing machine with a spacious drum for larger loads.
1,develop a washing machine that uses nanoparticles for deep cleaning without damaging the fabric.
0,use an inverter motor for quiet and energy-efficient operation.
1,incorporate a system that uses low-frequency sound waves to shake dirt and stains loose.
0,add a washing machine with a delay timer for scheduling washing cycles in advance.
1,create a washing machine that uses smart technology to adjust the water level based on the load size.
1,develop a washing machine that uses ultraviolet (uv) light to sanitize and deodorize clothes.
0,use a durable drum material to withstand high spin speeds.
1,incorporate a smart lint removal system that cleans the lint filter automatically after each wash.
0,include a washing machine with an automatic load balancing system for stable and efficient operation.
1,create a washing machine with a feature that automatically adjusts the detergent amount based on the load size and soil level.
1,incorporate a smart system that adjusts the wash cycle based on the local water hardness.
0,offer a washing machine with a removable detergent dispenser for easy cleaning.
1,develop a washing machine that uses eco-friendly and non-toxic cleaning pods instead of traditional detergent.
0,include a washing machine with a stainless steel drum for durability and hygiene.
1,design a washing machine that uses ai technology to identify the type of stains and adjusts the washing method accordingly.
0,add a washing machine with a pre-soak option for heavily soiled clothes.
1,create a washing machine with an intelligent system that optimizes the wash cycle based on the type of fabric  color  and dirt level.
1,incorporate a system that uses ozone to disinfect and deodorize clothes.
0,add a washing machine with a 'hand wash' program for delicate clothes.
1,design a washing machine that uses near-infrared light to identify different types of stains and adjusts the wash program accordingly.
0,include a washing machine with a self-diagnosis feature for easy troubleshooting.
1,develop a washing machine that uses a combination of steam and vacuum to remove dirt and kill bacteria.
1,create a washing machine that uses machine learning to optimize washing cycles over time.
0,use a direct drive motor for improved efficiency and durability.
1,develop a washing machine with a feature that alerts users when it's time to order more detergent.
0,offer a washing machine with an extra rinse option to ensure all detergent is removed from clothes.
1,design a washing machine that uses ai technology to identify any issues and provides troubleshooting guidance.
0,use a seal guard to prevent mold and mildew growth in the door seal.
1,incorporate a feature that detects the optimal amount of detergent based on the water hardness and dirt level.
0,provide a washing machine with a front-loading design for easy loading and unloading.
1,create a washing machine with an automatic detergent mixing system for a more effective wash.
1,develop a washing machine that uses high-frequency vibrations to shake dirt loose.
0,include a washing machine with a speed wash cycle for quick washing.
1,design a washing machine with a self-cleaning water filter.
0,offer a washing machine with a child lock feature for safety.
1,create a washing machine that uses electrostatic technology to attract and trap dirt and stains.
1,develop a washing machine that uses water vapor to loosen dirt and remove stains.
0,use an anti-vibration system for a quieter operation.
1,create a washing machine that uses advanced sensors to adjust the wash cycle based on the dirt level and type of fabric.
0,include a washing machine with a 'delicate' wash program for sensitive fabrics.
1,design a washing machine that uses a filter system to reuse water from the rinse cycle for the next wash cycle.
1,develop a washing machine with a feature that reduces water usage when washing a small load.
0,offer a washing machine with a 'bedding' wash program for washing large items like blankets and duvets.
1,create a washing machine with a feature that automatically disperses detergent evenly for a more effective wash.
1,incorporate a system that uses ultrasound technology to remove dirt and kill bacteria.
0,provide a washing machine with an 'anti-allergy' wash program for removing allergens from clothes.
1,create a washing machine with a feature that sanitizes the drum after each wash to prevent bacterial growth.
0,offer a washing machine with an led drum light for easy loading and unloading.
1,design a washing machine that uses thermal technology to kill bacteria and viruses.
1,develop a washing machine that uses smart technology to match the wash cycle with the electricity tariff to save energy.
0,include a washing machine with a refresh function that uses steam to refresh clothes.
1,incorporate a system that uses radio waves to remove dirt and kill bacteria.
0,offer a washing machine with a 'silk' wash program for washing delicate silk clothes.
1,create a washing machine with a feature that prevents over-foaming for a more effective wash.
1,design a washing machine that uses ultrasonic waves to clean clothes without damaging the fabric.
0,include a washing machine with an 'express' wash program for quick washing of lightly soiled clothes.
0,implement a touchless control system for the washing machine  allowing users to operate it without physically touching any buttons or knobs.
0,integrate a self-cleaning mechanism for the washing machine drum  reducing the need for manual cleaning and maintenance.
1,develop a washing machine with a built-in weight scale that automatically adjusts the water level and washing time based on the load's weight.
1,incorporate artificial intelligence to analyze fabric types and adjust the washing cycle  optimizing cleaning efficiency.
1,design a washing machine with a transparent lid that allows users to visually monitor the washing process without interrupting it.
1,create a washing machine with a built-in compartment for adding fabric softener or other laundry additives at the appropriate time during the wash cycle.
0,introduce a water-saving feature that recycles and filters water from previous cycles for subsequent washes.
1,incorporate advanced sensors to detect and prevent imbalances during the spin cycle  reducing noise and vibration.
0,implement a smart notification system that alerts users when the washing cycle is complete or if any issues arise during the process.
1,develop a washing machine with customizable washing programs  allowing users to create and save their preferred settings.
1,incorporate an energy monitoring feature that displays real-time energy consumption during each washing cycle.
0,design a washing machine with a built-in folding mechanism that automatically folds the clothes after they are washed and dried.
0,introduce a built-in steaming function for the washing machine  eliminating the need for a separate garment steamer.
1,create a washing machine with a built-in stain detection system that identifies and treats specific stains before initiating the wash cycle.
1,incorporate voice control capabilities into the washing machine  enabling users to operate it through voice commands.
0,implement a mechanism that minimizes water leakage during the washing process  reducing water wastage.
0,design a washing machine with interchangeable drum sizes  allowing users to switch between different capacities based on their needs.
1,develop a washing machine with a dedicated compartment for washing shoes  providing a gentle and effective cleaning solution.
0,introduce a noise-canceling feature for the washing machine  reducing the sound produced during operation.
1,incorporate wireless connectivity into the washing machine  enabling remote monitoring and control via a mobile app.
1,create a washing machine with an integrated drying function  eliminating the need for a separate dryer.
1,incorporate advanced filtration systems to remove microplastics and other pollutants from the washing machine's wastewater.
0,design a washing machine with a compact form factor  suitable for small living spaces or apartments.
0,implement a self-diagnostic system that detects and alerts users about potential malfunctions or maintenance requirements.
1,develop a washing machine with a built-in folding table  providing a convenient space for folding clothes after they are washed.
0,introduce a modular design for the washing machine  allowing users to easily replace or upgrade individual components.
1,incorporate an eco-mode feature into the washing machine  optimizing energy and water consumption for sustainable operation.
0,design a washing machine with a transparent door that becomes opaque during the wash cycle  ensuring privacy.
1,create a washing machine with a built-in clothes sorting mechanism  automatically separating different types of garments for efficient washing.
1,incorporate machine learning algorithms into the washing machine  enabling it to learn and adapt to users' preferences over time.
1,develop a washing machine with a built-in ironing function  reducing the need for manual ironing after clothes are washed.
0,implement a self-balancing system that automatically adjusts the load distribution inside the drum for smooth and stable operation.
0,introduce a built-in odor removal feature for the washing machine  eliminating unpleasant smells from clothes.
1,design a washing machine with a built-in detergent dispenser that automatically dispenses the right amount of detergent based on the load size.
0,create a washing machine with an ergonomic design that minimizes physical strain during loading and unloading of clothes.
1,incorporate augmented reality technology into the washing machine  providing interactive guides and troubleshooting assistance.
1,develop a washing machine with a built-in water softener  preventing mineral buildup and improving washing performance.
0,implement a quick wash feature that reduces the duration of the washing cycle for lightly soiled clothes.
1,design a washing machine with a built-in folding robot that neatly folds the clothes after they are washed and dried.
0,introduce a vibration reduction system for the washing machine  minimizing vibrations transmitted to the surrounding environment.
1,create a washing machine with customizable led lighting options  allowing users to personalize the machine's appearance.
1,incorporate a self-disinfection feature for the washing machine  eliminating bacteria and odors between wash cycles.
0,design a washing machine with a built-in drying rack  providing a convenient space for air-drying delicate garments.
0,implement a child lock feature for the washing machine  preventing accidental operation or tampering.
1,develop a washing machine with a dedicated compartment for washing pet bedding  ensuring hygienic cleaning for pet owners.
0,introduce a water temperature control system that allows users to adjust and customize the wash cycle temperature.
1,create a washing machine with a built-in folding assistant that guides users in folding clothes correctly.
1,incorporate a fabric identification system into the washing machine  automatically detecting and selecting the appropriate washing settings.
0,implement a time delay feature for the washing machine  allowing users to schedule the start of a wash cycle in advance.
1,design a washing machine with a built-in deodorizing function  removing odors from clothes during the wash cycle.
1,incorporate a uv sterilization feature into the washing machine  eliminating bacteria and allergens from clothes.
0,introduce a moisture sensor system that detects the dryness level of clothes and automatically adjusts the drying time.
0,implement a power outage recovery feature for the washing machine  resuming the interrupted cycle once power is restored.
1,develop a washing machine with a built-in fabric repair mechanism that mends small tears or loose threads during the wash.
1,incorporate a water hardness detection system into the washing machine  adjusting the detergent dosage accordingly.
0,design a washing machine with a built-in clothing folding assistant that provides step-by-step instructions for folding different garments.
1,create a washing machine with a dedicated compartment for washing delicate items  ensuring gentle treatment and protection.
0,introduce a self-adjusting leveling system for the washing machine  ensuring optimal stability on uneven surfaces.
0,implement a self-cleaning detergent dispenser for the washing machine  preventing residue buildup and cross-contamination.
1,design a washing machine with a built-in color restoration feature  reviving faded or dull-colored garments during the wash.
1,incorporate a smart sorting feature into the washing machine  automatically categorizing clothes based on fabric type or color.
0,introduce a water-saving mode for the washing machine  reducing water consumption without compromising cleaning performance.
1,create a washing machine with a built-in fabric softener infusion system  ensuring soft and fresh-smelling clothes.
1,develop a washing machine with a dedicated compartment for washing shoes  providing a gentle and efficient cleaning solution.
1,incorporate a noise-reduction feature into the washing machine  minimizing operational noise for a quieter laundry experience.
0,implement a water flow optimization system for the washing machine  reducing turbulence and enhancing cleaning efficiency.
1,design a washing machine with a built-in disinfection module  eliminating bacteria and viruses during the wash cycle.
1,introduce a garment rejuvenation feature for the washing machine  refreshing wrinkled or crumpled clothes during the wash.
0,create a washing machine with a built-in clothes folding robot  automating the folding process after clothes are dried.
0,implement a self-cleaning filter system for the washing machine  preventing clogs and maintaining optimal performance.
1,design a washing machine with a dedicated compartment for washing baby clothes  ensuring hygienic cleaning for infants.
0,introduce a vibration monitoring system for the washing machine  detecting and alerting users of excessive vibrations.
1,create a washing machine with a built-in fabric repair function that mends minor damages during the wash cycle.
0,implement a smart energy-saving feature for the washing machine  optimizing energy usage based on load size and type.
1,develop a washing machine with a dedicated compartment for washing sportswear  providing specialized cleaning programs.
1,incorporate a garment tracking system into the washing machine  allowing users to monitor the progress of individual items.
0,introduce a self-adjusting water pressure system for the washing machine  optimizing water usage for efficient cleaning.
1,design a washing machine with a built-in clothes steaming function  eliminating wrinkles and refreshing garments.
1,incorporate a scent infusion feature into the washing machine  adding a pleasant fragrance to clothes during the wash.
0,implement a temperature-controlled drying feature for the washing machine  preventing overheating and garment damage.
1,create a washing machine with a dedicated compartment for washing reusable diapers  ensuring thorough and hygienic cleaning.
1,introduce a customizable cycle memory feature for the washing machine  allowing users to save and recall preferred settings.
0,design a washing machine with a built-in water softening system  reducing mineral buildup and enhancing cleaning performance.
1,develop a washing machine with a dedicated compartment for washing pet accessories  ensuring hygienic cleaning for pet owners.
